track id,track name,artist,danceability,energy,key,loudness,mode,speechiness,acousticness,instrumentalness,liveness,valence,tempo,lyrics
2grAr8pWMuLWn8ZYEE9wDV,Never Seen the Rain,Tones And I,0.485,0.461,9.0,-5.646,1.0,0.0444,0.44,0.0,0.23199999999999998,0.324,87.009,"All your life, no
You couldn't be mad about it
You've been sailing, sailing oh
You couldn't be sad about it
And it's been all this time
And you haven't lived without it
You are shining, shining it seems though
That your life, you've found it

No oh oh oh
But you've never
No, you've never seen the rain
No, oh oh oh
But you've never
No you've never seen the rain

And it gets you down
But that's okay
You've been pushed 'round
You feel the pain
"
3Ex5RFJRUdpHcDOLXJOVLy,Raising Hell (feat. Big Freedia),Kesha,0.6759999999999999,0.8690000000000001,1.0,-4.689,0.0,0.132,0.00134,6.77e-05,0.0692,0.271,114.991,"Ooh, oh, oh, oh
Let's go

Hallelujah
I'm still here, still bringing it to ya
Om like Buddha
Good girls know how to get hard too, ya

I'm all done up in my Sunday best
No one can shame 'cause I love this dress
Hungover, how'd it go? Holy mess
Doin' my best, yes I'm blessed

Oh, if you couldn't tell
We can always find the trouble, we don't need no help
Singing oh, mama raised me well
But I don't wanna go to Heaven without raising hell (Get in)

Get it
Drop it down low, hit it, hit the pole with it
Drop it down low, drop it down low
Drop, dr-drop it down low, drop it down low (Get it)
Drop it, drop it, drop it, drop-drop-drop it down, down low
"
2Tl6yt61BEQXygpltqvgzD,Clean,Hey Violet,0.591,0.735,10.0,-4.208,1.0,0.0406,0.00528,0.0,0.11199999999999999,0.632,143.09799999999998,"I was hooked on you
Couldn't get you out of my veins
Every day on you, oh
Serotonin toxic I crave, yeah
Half my shit was over at your place and I'm
Pretty sure our friends are all the same, oh God
Breakups get so messy

Don't know how I came out (Clean)
My conscious is (Clean)
I broke it off (Clean)
I've washed my hands of you (Clean)
I wiped the slate (Clean)
There ain't a trace (Clean)
I've washed my hands of you
Like Hallelujah (Hallelujah)
I saw the light (I saw the light)
Like Hallelujah (Hallelujah)
Made it to the other side (Clean)
Clean (Clean, clean)
I've washed my hands of you

"
7yfi8B8opXjnRh4VZnOkz9,Cool,Jonas Brothers,0.6829999999999999,0.598,0.0,-5.487,1.0,0.0423,0.00873,0.0,0.156,0.62,78.969,"I'm feeling so cool
From top to the bottom, just cool
Every little thing that I do
Well, dammit, I'm feelin' so cool, yeah
Woke up feelin' like a new James Dean
I comb my hair like an old school sheen
I'm feelin' high like a late night summer of last year (Yeah)
Standin' there with the red dress on ya
A Killer Queen like a young Jane Fonda
Is it me or am I just havin' a good year?

Lately, I've been feelin' so cool (Cool)
Top to the bottom, just cool (Cool)
Every little thing that I do (Do)
Dammit, I'm feelin' so coo-oo-oo-oo-oo-ool
It's like, ooh (Ooh), maybe I should bottle my moves (Moves)
"
43rA71bccXFGD4C8GOpIlN,I Forgot That You Existed,Taylor Swift,0.664,0.316,5.0,-10.345,1.0,0.519,0.298,2.03e-06,0.0812,0.541,92.875,"How many days did I spent thinking
'Bout how you did me wrong, wrong, wrong?
Lived in the shade you were throwing
'Til all of my sunshine was gone, gone, gone
And I couldn't get away from you
In my feelings more than Drake, so yeah
Your name on my lips, tongue-tied
Free rent, living in my mind

But then something happened one magical night

I forgot that you existed
And I thought that it would kill me, but it didn't
And it was so nice
So peaceful and quiet
I forgot that you existed
It isn't love, it isn't hate, it's just indifference
I forgot that you...
"
5A3fPy30SN2wuzrahpcxvV,"Don't Give Up On Me - (From ""Five Feet Apart"")",Andy Grammer,0.6409999999999999,0.537,0.0,-5.452000000000001,0.0,0.0282,0.0875,9.05e-06,0.115,0.0681,112.86399999999999,"I will fight
I will fight for you
I always do, until my heart
Is black and blue

And I will stay
I will stay with you
We'll make it to the other side
Like lovers do

I'll reach my hands out in the dark
And wait for yours to interlock
I'll wait for you
I'll wait for you

'Cause I'm not givin' up
I'm not givin' up, givin' up
No not yet
Even when I'm down to my last breath
Even when they say there's nothin' left
So don't give up on
"
2FOwRoyI2TTujfAGmHgEJP,Genetics,Meghan Trainor,0.7879999999999999,0.743,8.0,-7.711,1.0,0.32799999999999996,0.0284,0.00124,0.34,0.423,122.005,"My genetics
My genetics
My genetics
G-E-N-E-T-I-C

Beauty queen since seventeen, at least to me
I was born with it
Maybelline is good to me, but I believe
I was born with it

I'm workin', workin, workin', I've been working on myself
But I can't take cred 'cause it's from somebody else
Watch me work it, work it, work it, I've been sweating on myself
All them boys, all them girls, make them stop

How you get that bod?
Is it from God?
Did you work real hard?
G-E-N-E-T-I-C-S
How you get that bass?
Is it all fake?
Made in LA
G-E-N-E-T-I-C-S
G-E-N-E-T-I-C-S

My DNA is graded A
"
6oJ6le65B3SEqPwMRNXWjY,Higher Love,Kygo,0.693,0.6779999999999999,8.0,-7.159,1.0,0.0324,0.0154,6.05e-06,0.10099999999999999,0.40399999999999997,103.95200000000001,"Bring me higher love, love
Bring me higher love

Think about it, there must be a higher love
Down in the heart or hidden in the stars above
Without it, life is wasted time
Look inside your heart, and I'll look inside mine

Things look so bad everywhere
In this whole world, what is fair?
We walk the line and try to see
Falling behind in what could be, oh

Bring me a higher love
Bring me a higher love, oh
Bring me a higher love
Where's that higher love I keep thinking of?

Bring me higher love, love
Bring me higher love (oh)
Bring me higher love, love
"
6ucmgsair6pvRYfwgvI6e0,"SPIRIT - From Disney's ""The Lion King""",Beyoncé,0.23800000000000002,0.435,5.0,-8.096,1.0,0.0497,0.009559999999999999,0.0,0.0981,0.0447,78.797,"Uishi kwa muda mrefu mfalme
(Uishi kwa, uishi kwa)
Uishi kwa muda mrefu mfalme
(Uishi kwa, uishi kwa)

Yeah, yeah, and the wind is talkin'
Yeah, yeah, for the very first time
With a melody that pulls you towards it
Paintin' pictures of paradise

Sayin', rise up
To the light in the sky, yeah
Watch the light lift your heart up
Burn your flame through the night

Woah, spirit
Watch the heavens open (Open)
Yeah
Spirit
Can you hear it callin'? (Callin')
Yeah

"
2iuZJX9X9P0GKaE93xcPjk,Sugar,Maroon 5,0.748,0.7879999999999999,1.0,-7.055,1.0,0.0334,0.0591,0.0,0.0863,0.884,120.07600000000001,"I'm hurting, baby, I'm broken down
I need your loving, loving, I need it now
When I'm without you
I'm something weak
You got me begging
Begging, I'm on my knees

I don't wanna be needing your love
I just wanna be deep in your love
And it's killing me when you're away
Ooh, baby
'Cause I really don't care where you are
I just wanna be there where you are
And I gotta get one little taste

Your sugar
Yes, please
Won't you come and put it down on me
I'm right here, 'cause I need
Little love and little sympathy
Yeah you show me good loving
Make it alright
Need a little sweetness in my life
Your sugar
Yes, please
Won't you come and put it down on me

My broken pieces
You pick them up
Don't leave me hanging, hanging
Come give me some
When I'm without ya
"
222B3aljXx6fFwKmFjuBED,Woman Like Me (feat. Nicki Minaj),Little Mix,0.754,0.8540000000000001,5.0,-3.449,0.0,0.0608,0.177,0.0,0.0808,0.8,75.002,"I always say what I'm feeling
I was born without a zip on my mouth
Sometimes I don't even mean it
It takes a little while to figure me out

I like my coffee with two sugars in it
High heels and my jewelry dripping
Drink and I get all fired up (Hey, hey, hey)
Insecure but I'm working with it
Many things that I could get rid of
Ain't about to give it up

I made a few mistakes, I regret it nightly
I broke a couple hearts that I wear on my sleeve
My mama always said, girl, you're trouble
And now I wonder, could you fall for a woman like me

And every time we touch, boy, you make me feel weak
I can tell you're shy and I think you're so sweet
Spending every night under covers and
Still I wonder, could you fall for a woman like me (A woman)

Woman like me, like a woman like me
La-la-la woman like me, like a woman like me (A woman)
La-la-la woman like me, like a woman like me
La-la-la woman like me, like a woman like me

And baby, just be mine for the weekend
We can get a takeaway and sit on the couch
Or we could just go out for the evening
"
1mea3bSkSGXuIRvnydlB5b,Viva La Vida,Coldplay,0.485,0.619,5.0,-7.115,0.0,0.0289,0.0941,3.31e-06,0.109,0.41600000000000004,138.017,"I used to rule the world
Seas would rise when I gave the word
Now in the morning I sleep alone
Sweep the streets I used to own

I used to roll the dice
Feel the fear in my enemy's eyes
Listen as the crowd would sing
""Now the old king is dead! Long live the king!""

One minute I held the key
Next the walls were closed on me
And I discovered that my castles stand
Upon pillars of salt and pillars of sand

I hear Jerusalem bells a ringing
Roman Calvary choirs are singing
Be my mirror, my sword and shield
"
5icOoE6VgqFKohjWWNp0Ac,Here With Me,Marshmello,0.7909999999999999,0.565,5.0,-3.9330000000000003,0.0,0.0439,0.0623,0.0,0.156,0.18100000000000002,99.961,"Can I tell you something just between you and me?
When I hear your voice, I know I'm finally free
Every single word is perfect as it can be
And I need you here with me

When you lift me up, I know that I'll never fall
I can speak to you by saying nothing at all
Every single time, I find it harder to breathe
'Cause I need you here with me

Every day
You're sayin' the words that I want you to say
There's a pain in my heart and it won't go away
Now I know I'm falling in deep
"
3RauEVgRgj1IuWdJ9fDs70,The Man,Taylor Swift,0.777,0.6579999999999999,0.0,-5.191,1.0,0.054000000000000006,0.0767,0.0,0.0901,0.633,110.04799999999999,"I would be complex
I would be cool
They'd say I played the ﬁeld before I found someone to commit to
And that would be ok
For me to do
Every conquest I had made would make me more of a boss to you

I'd be a fearless leader
I'd be an alpha type
When everyone believes ya
What's that like?

I'm so sick of running as fast I can
Wondering if I'd get there quicker
If I was a man
And I'm so sick of them coming at me again
'Cause if I was a man
Then I'd be the man
I'd be the man
I'd be the man

They'd say I hustled
Put in the work
"
0OGNtqKkjI7FCE9HZ4Khgo,Power Over Me,Dermot Kennedy,0.42,0.843,9.0,-4.231,0.0,0.121,0.0519,0.0,0.106,0.491,173.827,"Mmm
Mmm
Wanna be king in your story
I wanna know who you are
I want your heart to be for me
Oh, I
Want you to sing to me softly
'Cause then I might run in the dark
That's all our love ever taught me
Oh, I

Call and I'll rush out
Mmm
All out of breath now

You got that power over me
My, my
Everything I hold dear resides in those eyes
You got that power over me
My, my
The only one I know, the only one on my mind
You got that power over me
(My, my)
You got that power over me
(My, my)
You got that power over me
"
1zHmzN75pKHflokUGZh7sA,"Hurt Me - From ""Songland""",Meghan Trainor,0.873,0.6509999999999999,11.0,-5.937,0.0,0.0759,0.21899999999999997,0.0,0.27,0.675,113.001,"You don't get to hurt me
You don't get to hurt me

We were good 'til it wasn't
'Til it all fell apart (Uh huh)
Every tear wasn't worth it
So I had to move on (Uh huh)
We were done from the get go
I wouldn't say we were friends (Uh huh)
But I ain't easy to let go
You don't have to pretend (Uh huh)

You're acting like a child now
Trying to take your anger out
Well, get my name out of your mouth
If you're just gonna tear me down

Don't be so bitter, how 'bout we keep it sweet? (Ah)
No need to talk to me like we're enemies (Ah)
No, you were never worth all my energy
And just 'cause you're hurting don't mean you get to hurt me
Don't be so bitter, how 'bout we keep it sweet? (Uh huh)
No need to talk to me like we're enemies (Uh huh)
"
6OtCIsQZ64Vs1EbzztvAv4,Good Life,OneRepublic,0.634,0.69,6.0,-7.803999999999999,1.0,0.052000000000000005,0.0771,0.0,0.132,0.645,94.988,"Woke up in London yesterday
Found myself in the city, near Picadilly
Don't really know how I got here
I got some pictures on my phone

New names and numbers that I don't know
Address to places like Abbey Road
Day turns to night
Night turns to whatever we want
We're young enough to say

Oh, this has gotta be the good life
This has gotta be the good life
This could really be a good life, good life
I say oh, got this feeling that you can't fight
Like this city is on fire tonight
This could really be a good life
A good, good life
Oh, oh, oh, oh, oh, oh

To my friends in New York, I say hello
My friends in L.A. they don't know
Where I've been for the past few years or so
Paris to China to Colorado
"
6aIAuKNU8JlVaTmoCYYN6U,Glad He's Gone,Tove Lo,0.795,0.595,1.0,-8.073,1.0,0.0698,0.0823,0.0,0.128,0.502,91.025,"He's gone, he's gone
You're better off, I'm glad that he's gone
He's gone, he's gone
You're better off, I'm glad that he's gone

I got a girlfriend, she's got a boyfriend
She calls me crying every day 'cause they got problems
He likes complaining, she's compromising
Coming to me for real advice when he just playing

I can tell she loves him way too deep
He loves being fucking hard to please
Cover the basics, it's pretty easy
He's a bitch with some expectations

Did you go down on his birthday? (Yup)
Did you let him leave a necklace? (Yup)
Or did you show him all your crazy? (No)
Blow him up on the weekends
Did you give in to his ego?
Just to give a little confidence
I think you know it's time to let go
(You're better off I'm glad that he's gone)
My baby

Never no tears for that sucker
Only one dick, that's a bummer
Dancing all night, get guys' numbers
(Better off, I'm glad that he's gone, he's gone)
"
2WyRfGeHo97VC5mP1BBSzr,Mother's Daughter,Miley Cyrus,0.6809999999999999,0.865,1.0,-4.132,0.0,0.0594,0.00464,0.0016899999999999999,0.149,0.528,91.01700000000001,"Hallelujah, I'm a freak, I'm a freak, hallelujah
Every day of the week, I'ma do ya like I want to
I'm a Nile crocodile, a Piranha

Oh my gosh, she got the power
Oh, look at her, she got the power
So, so, so

Don't fuck with my freedom
I came up to get me some
I'm nasty, I'm evil
Must be something in the water
Or that I'm my mother's daughter
Don't fuck with my freedom
I came up to get me some
I'm nasty, I'm evil
Must be something in the water
Or that I'm my mother's daughter

So, back up, back up, back up, back up, boy, ooh
Back up, back up, back up, back up, boy, ooh

Hallelujah, I'm a witch, I'm a witch, hallelujah
"
23zzZpPotrX7adSotiOvtP,Castles,Freya Ridings,0.672,0.752,4.0,-4.8660000000000005,1.0,0.0843,0.0046,0.00047000000000000004,0.055999999999999994,0.429,116.945,"You learnt my love, you hit the target
You get that rush and then you walk out the door
You kept me small, it's what you wanted
I never noticed

You held my hand into the darkness
I didn't care, it made me just want you more
My God, your love, it seems so harmless
I never noticed

And I hate that you're gone
And I hate that I don't wanna let go
And I hate that you think that I'm weak
'Cause I don't wanna let you know

I'm gonna build castles
From the rubble of your love
From the rubble of your love
I'm gonna be more than
You ever thought I was
You ever thought I was (ooh)

"
3HVWdVOQ0ZA45FuZGSfvns,I Don't Care (with Justin Bieber),Ed Sheeran,0.7979999999999999,0.675,6.0,-5.041,1.0,0.0442,0.0912,0.0,0.0894,0.8420000000000001,101.956,"I'm at a party I don't wanna be at
And I don't ever wear a suit and tie, yeah
Wonderin' if I could sneak out the back
Nobody's even lookin' me in my eyes
Can you take my hand?
Finish my drink, say, ""Shall we dance?"" (Hell, yeah)
You know I love ya, did I ever tell ya?
You make it better like that
Don't think I fit in at this party
Everyone's got so much to say (Yeah)
I always feel like I'm nobody, mmm
Who wants to fit in anyway?
'Cause I don't care when I'm with my baby, yeah
All the bad things disappear
And you're making me feel like maybe I am somebody
I can deal with the bad nights
When I'm with my baby, yeah
Ooh, ooh, ooh, ooh, ooh, ooh
'Cause I don't care as long as you just hold me near
You can take me anywhere
And you're making me feel like I'm loved by somebody
I can deal with the bad nights
"
6g0Orsxv6glTJCt4cHsRsQ,Formation,Beyoncé,0.8959999999999999,0.621,5.0,-6.857,0.0,0.237,0.00532,0.0,0.196,0.818,121.96600000000001,"Y'all haters corny with that Illuminati mess
Paparazzi, catch my fly, and my cocky fresh
I'm so reckless when I rock my Givenchy dress (stylin')
I'm so possessive so I rock his Roc necklaces
My daddy Alabama, Momma Louisiana
You mix that negro with that Creole make a Texas bama

I like my baby heir with baby hair and afros
I like my negro nose with Jackson Five nostrils
Earned all this money but they never take the country out me
I got a hot sauce in my bag, swag

I see it, I want it, I stunt, yellow-bone it
I dream it, I work hard, I grind 'til I own it
I twirl on them haters, albino alligators
El Camino with the seat low, sippin' Cuervo with no chaser

Sometimes I go off (I go off), I go hard (I go hard)
Get what's mine (take what's mine), I'm a star (I'm a star)
Cause I slay (slay), I slay (hey), I slay (okay), I slay (okay)
"
4Sib57MmYGJzSvkW84jTwh,ME! (feat. Brendon Urie of Panic! At The Disco),Taylor Swift,0.614,0.8390000000000001,0.0,-4.143,1.0,0.0702,0.0291,0.0,0.11199999999999999,0.657,182.123,"I promise that you'll never find another like me

I know that I'm a handful baby, uh
I know I never think before I jump
And you're the kind of guy the ladies want
(And there's a lot of cool chicks out there)

I know that I went psycho on the phone
I never leave well enough alone
And trouble's gonna follow where I go
(And there's a lot of cool chicks out there)

But one of these things is not like the others
Like a rainbow with all of the colors
Baby doll, when it comes to a lover
I promise that you'll never find another like

Me-eh-eh, ooh-ooh-ooh-ooh-ooh
I'm the only one of me
Baby, that's the fun of me
Eh-eh-eh, ooh-ooh-ooh-ooh-ooh
You're the only one of you
Baby, that's the fun of you
And I promise that nobody's gonna love you like me-eh-eh

"
6h2wpo2pshM8QnAvRySEO0,Soulmate,Lizzo,0.693,0.8490000000000001,7.0,-4.5169999999999995,1.0,0.0892,0.00466,0.0012699999999999999,0.503,0.767,99.021,"True story
No glory, let's go

Yeah, the old me used to love a Gemini
Like a threesome, fuckin' with him every night
A lotta two-faced people show me both sides
So I figured out I gotta be my own type

They used to say to get a man, you had to know how to look
They used to say to keep a man, you had to know how to cook
But I'm solo in Soho, sippin' Soju in Malibu
It's a me, myself kinda attitude

'Cause I'm my own soulmate (Yeah, yeah)
I know how to love me (Love me)
I know that I'm always gonna hold me down
Yeah, I'm my own soulmate (Yeah, yeah)
No, I'm never lonely (Lonely)
I know I'm a queen, but I don't need no crown
Look up in the mirror like ""Damn, she the one""

One, one, one, one, one, one (The one)
Like ""Damn, she the one""
One, one, one (The one)
Bad bitch in the mirror like ""Yeah, I'm in love""
Love, love, love, love, love, love (In love)
Like ""Yeah, I'm in love""
"
5Glf3tBr73L1fbO9u4pL7r,"Badass Woman - From The Motion Picture ""The Hustle""",Meghan Trainor,0.726,0.8690000000000001,6.0,-3.978,1.0,0.0638,0.0181,0.00022,0.332,0.529,112.96600000000001,"I'm a badass woman (Ooh)
What's wrong with that?
Can't hold me back
Yeah, I'm a badass woman
Just made like that
But I'm proud of that
'Cause I'm a badass woman

Never second guess me
'Cause, baby, I'm the boss
Don't underestimate me
'Cause I'm the one in charge

I am smarter than you give me credit for
And I'm way stronger than I ever been before
I'm a force of nature that you can't ignore
You can't ignore, you can't ignore no more

I'm a badass woman (Ooh)
What's wrong with that?
Can't hold me back
Yeah, I'm a badass woman
Just made like that
"
6o3QUC5oAE4g6WxRIFcZtb,Wishing Well,Juice WRLD,0.65,0.613,9.0,-6.13,0.0,0.128,0.00336,0.0,0.267,0.0804,149.972,"I can't breathe (Chopsquad), I can't breathe, 999
Waiting for the exhale
I toss my pain with my wishes in a wishing well

I can't breathe, I'm waiting for the exhale
Toss my pain with my wishes in a wishing well
Still no luck, but oh, well
I still try even though I know I'm gon' fail
Stress on my shoulders like a anvil
Perky got me itching like a anthill
Drugs killing me softly, Lauryn Hill
Sometimes I don't know how to feel

Ring-ring, phone call from depression
You used my past and my memories as a weapon
On the other line, I talk to addiction, huh
Speaking of the devil, all the drugs, I miss them

This can't be real, is it fiction?
Somethin' feels broke, need to fix it
"
7KzIHJu1KFh4D8VhhmvTro,Nothing to Work Out,Elko,0.65,0.746,6.0,-5.067,0.0,0.0345,0.0262,0.0,0.0959,0.586,149.928,"Seeing it's all good it's all fine, baby
I'm basically stuck in my mind
Seeing you post pictures with other guys
But I've realized, yeah I've realized

That there's nothing to work out, baby
That shit hurts no doubt
But I'm losing my whole mind, right now
Don't come back this time
Farewell

We can't stay friends, not like this
Cannot pretend, not like that
All, in the end, we fucked up
It's not just you both of us

Don't you remember this car
Baby I got it for us
Until we both fell apart
"
4C4HQvKybvDoqg57TH4Ewk,Seasons,Ollie,0.7290000000000001,0.748,7.0,-7.034,1.0,0.28,0.134,0.0,0.11,0.727,152.025,"Lately, I go a little bit crazy
Misunderstood
Seasons change, people change
(Yeah, that's the fucking take bro)

Lately, I go a little bit crazy
Misunderstood
Seasons change, people change
Hooh hoooh
What a feeling
And maybe, yeah
I'm stressed out on the daily
But life's been good
Seasons change, people change
Hooh hoohh
What a feeling

Yeah, what a feeling I feel
Lately feelings don't help
Overthinking been real
"
3h1QEqhVgDOpFQ7qfYH62L,Wishing and Hoping,Landon Cube,0.499,0.884,4.0,-4.601,0.0,0.0556,0.006540000000000001,2.8899999999999998e-05,0.16,0.547,175.049,"I be on some other shit some days
Wishing that the sunshine go away
I should get the fuck out of L.A
You might need to get the fuck up out my face
Man I miss the rain, I hate to say
I ain't eat a god damn thing all day
I just smoke until I fade away
Man I hope my life don't go to waste

Hoping that my girl ain't what they say
I think that she good, I hope, I pray
Praying that the sunshine go away
Praying that this life just go my way
"
5hNnZd1qJ1tJdVU7vwQ1DX,Demons,Merkules,0.745,0.44299999999999995,0.0,-10.489,1.0,0.298,0.583,0.0,0.128,0.38799999999999996,106.13,
71staqCBFArNBB1O7Sw3J8,Bad Dream,Jutes,0.77,0.648,9.0,-5.675,1.0,0.0323,0.251,4.2999999999999995e-06,0.132,0.41700000000000004,99.988,
0A3nVGUkAN4MDBcnIXrheL,Fire,MASN,0.542,0.433,4.0,-8.333,1.0,0.0344,0.391,0.0,0.0836,0.23,83.569,
22INV92iL1i9gg0pJOoMCN,Not Enough,bloom,0.653,0.486,7.0,-8.792,0.0,0.0314,0.45799999999999996,0.0,0.149,0.447,146.023,"I know to hide my feels inside
I'm rolling the dice with all my life
I'm mentally weak, incomplete
Take care of me

Pop a pill I feel fucked up
Ten toes down when things get rough
Fuck that bitch, she's not enough
Sprinkle molly on my tongue
When she call I won't pick up

Taken, don't bother me
Breakin' the law for me
Racin' through robbery
No lottery, I know I'm bleedin'
"
0EgkGFmAdFLkZVtbyGlQRe,Top Gone (with Lunay),Lil Mosey,0.83,0.467,6.0,-7.204,0.0,0.0872,0.0512,0.0,0.0648,0.529,104.01700000000001,"Ayy, Benjamin he got Benjamins

Baby, don't you stress, gon' let a nigga flex
Lil' mama, I'ma thumb through it (I'ma do it)
I know he's upset 'cause you're ridin' in the 'Vette
And the top all gone (Skrrt, skrrt)
I run to him, like next, don't care who vex
'Cause shawty I'm havin' fun (Havin' fun)
I let the 100s go fast (Go fast)
Shakira hips, they don't lie (No)

Shawty so bad, yeah she so fine (So fine)
I ain't hit one time, had to hit three time (Yeah, yeah)
Put her on the first jet, now she say she worldwide (Worldwide)
Walking through this money, ayy, it stackin' knee-high (High)
She's so bad (Bad)
Everybody look when we pass (Pass)
Took her from you, you sad (You sad)
Put her in her first Maybach (Skrrt off), and it's two door
You ain't seen this shit before, yeah, it's fine (It's fine)
You gon' get used to this life in no time (No time)
See what you doin' (Doin')
I love how you movin' (Movin')
So I say-

"
3f1ChZHm6v4KdUaEW5y5qd,Me and You,Cold Hart,0.613,0.614,1.0,-7.235,1.0,0.0439,0.0143,0.0,0.094,0.198,93.984,"Charlie Shuffler

Run away with the one
That's gon' be there 'til it's done
Take the blame for the gun
That's gon' be there for your son
If it's me, I don't know
But at least, I'll make her smile
Would you lie here for a while?
Would you lie here 'til I die?

When I look at you
I can see right through
And you know it's true
So you love me too
Girl, I always knew
It was me and you
And you'll know it's true
When you say, ""I do""

You know I'ma say, ""I do"" (You know)
'Cause every time I leave I be missin' you (I be missin' you)
And I know you gon' say, ""I do"" (Oh)
'Cause I look up in your eyes, I can tell it's true (True)
"
