track id,track name,artist,danceability,energy,key,loudness,mode,speechiness,acousticness,instrumentalness,liveness,valence,tempo,lyrics
6xKmHTA27EgOhWXIRppr32,Pancakes for Dinner,Lizzy McAlpine,0.753,0.266,11.0,-11.453,1.0,0.0478,0.759,0.0,0.11,0.321,142.026,"Don't wanna be forward
Don't wanna cross a line
But if I were to crash in this plane tonight
I'd want you to know this

Don't wanna say too much
Intrude on your space
But if I were to crash and I never made it home
I'd want you to know this

Oh, and to tell you is too scary
So I'll just say something else
And I wish that you could hear me
When I talk to myself
But this plane might not land safely
So, what the hell do I have to lose
If I just tell you?

I wanna eat pancakes for dinner
I wanna get stuck in your head
"
0Vuivr9LBX6ZQtshFmBM03,Why Don't I Care?,gglum,0.302,0.142,3.0,-17.533,1.0,0.0315,0.701,0.0949,0.14400000000000002,0.0757,68.559,
3UsCeel9NuKKmpls5B4osK,Do You Ever Think of Me?,yaeow,0.7709999999999999,0.253,1.0,-13.368,1.0,0.182,0.7,0.0,0.0627,0.662,129.944,"Been a long time since you drove away
It's been a long time since you called my name
And I wonder, do you ever think of me?

It's been a long time since you drove away
It's been a long time since you called my name
And I wonder, do you ever think of me?
I try to stay strong but my heart is blue
Something always seem to bring me back to you
'Cause I wonder, do you ever think of me?

Yeah, I be thinking 'bout you every second
Every day, I guess it's all the time, huh?
"
2ohheZzavZxvs6Gm3o8EUS,Bubble,rei brown,0.7,0.537,1.0,-6.932,1.0,0.0339,0.569,0.159,0.131,0.5670000000000001,147.97799999999998,"I'm trapped in a bubble
I'm having trouble
Getting air
It's so unfair
You're over there
'Cause I just wanna hold you tight
And watch the clouds go by

When I see my friends again I'll be okay
When we get together next we'll celebrate
When I see my friends again I'll be okay
When we get together next we'll celebrate

How you been?
Staying in
"
3hnj2130ThmuKOthw825PD,Brittle,Char Chris,0.617,0.0798,0.0,-17.707,1.0,0.032,0.935,0.000327,0.109,0.0916,89.98700000000001,"If I'm so great
Then why don't you love me
If I'm so cool
Then why aren't you here

On the phone
For a tragic fifteen minutes
I say it's okay
As I'm holding in my tears

I've cried alone
Three days in a row now
Waiting for you to come over
But I still wanted you somehow

I didn't know
There'd be a last time I would hold you
"
5JzhtNahrk4YvntIa7jGNp,September 13th,Jess Benko,0.8390000000000001,0.013999999999999999,0.0,-24.052,1.0,0.0754,0.925,0.0,0.10300000000000001,0.21100000000000002,100.051,
0xIxUesRUXMlX1zYitECjs,Silhouette,Sky McCreery,0.6579999999999999,0.249,9.0,-14.812000000000001,1.0,0.0794,0.912,0.00238,0.0893,0.0391,118.007,"If I'm concerned about the subtleties
Would you beg me?
Do you hate me, girl?
I think I dwell on your silhouette
'Cause you made me
You fucked me up

It's the acid on my skin
It reminds me where I've been
If I threw my selfish sins
Will I fall back in your arms?
"
4UYeZa4OZYSpH6D0COt9my,haircuT,COLETON RUBIN,0.7440000000000001,0.252,7.0,-15.562999999999999,1.0,0.057999999999999996,0.866,0.000947,0.107,0.524,83.02600000000001,
7CIUvrs3v8owdrZTRey7RV,blue jeans,familypet,0.607,0.49700000000000005,9.0,-9.665,0.0,0.0333,0.134,0.0152,0.345,0.35700000000000004,89.95700000000001,
2JcMKZhCd5RwcwRbEG58wu,"a world of chaos (feat. Rxseboy, Jomie & Ivri)",Powfu,0.777,0.457,4.0,-6.525,1.0,0.0823,0.48100000000000004,0.0,0.114,0.652,136.037,"Spilled a glass of wine and stained the kitchen floor
We never used to fight but now it feels like war
Sadness in our home
But at least I'm not alone

Spilled a glass of wine and stained the kitchen floor
We never used to fight but now it feels like war
Diggin' nails into my bones
I'm never happy in this home
I'm waking up at night when sleep is hard to catch
I never see you smile, you never call me back
Yeah, we're breaking on both sides
Trying to find peace under the sky

We got thrown off of our axis
With that newborn up in the back seat
All these plot twists without happiness
Now our ending 'bout to be tragic
We need real love when that time comes
"
3uG6rdUthcTvbK70fwkPky,Body,Jordan Suaste,0.359,0.324,7.0,-8.687000000000001,1.0,0.0381,0.629,0.0,0.0649,0.326,98.024,"I'm more than
I'm more than
I'm more than

Body, let me see your body
Take off all your makeup and your clothes
Trust me, why don't you just trust me?
You're the only beauty, show me more

You're not a dime a dozen
Oh your skin is golden
Let me show the whole damn world
You're one in a billion
The only thing you're missin'
Is some tape over that mouth

Body, I'm more than my body
You can pack your things up, buh bye, just go
Body, I'm more than my body
Don't owe you a thing, no, not at all
"
5lbdxt9C6rsELTimTkyMn8,I Need U,yaeow,0.402,0.405,9.0,-12.485999999999999,1.0,0.0713,0.513,0.0167,0.155,0.07200000000000001,84.87299999999999,"I'm the boy in the movie scene
Who just wants to leave
And never come back
And you're the perfect company
You got dreams like me
Please can you take me away?

So let me ride, ride, ride, ride, ride
Away with you
Into the dark, into my heart
I'll follow you
Let me ride, ride, ride, ride, ride
Away with you
'Cause all of my scars are broken inside
I need you
"
7mtVTmh197xn1JYcZekASZ,Love Me Like a Fool,Lokel,0.634,0.29,8.0,-12.287,0.0,0.0619,0.0928,0.0628,0.107,0.34,114.95700000000001,"If I can't (can't) hold you (you) back
I can't be okay (okay) with that (that)
Love me (Love me) until I ('til I) have nothing to give
If I can't (I can't) hold you (you) back
I can't (I can't) be okay (okay) with that (that)
Love me (love me) until I ('til I) have nothing to give
If I can't hold you back
I can't be okay with that
Love me until I have nothing to give

"
3XIsyH2KHrcPCkE8wkcKX6,Breadcrumbs,Andy Leon,0.423,0.147,1.0,-14.855,1.0,0.0323,0.867,4.3200000000000007e-05,0.0686,0.23600000000000002,126.92299999999999,"4 steps away from your front door.
I stop to breath and I take 2 steps more.
The smile doesn't reach my eyes.
And nervous laughter turns into a sigh.

And it goes on and on and on.
We float on nothing's wrong.
The breadcrumbs gone, they're gone, they're gone.
And we're so far from home,
"
3xiNoKG659HRaQwOoE7bHF,say those things,eli.,0.784,0.353,4.0,-6.755,1.0,0.0377,0.531,4.51e-06,0.292,0.442,130.162,"Sayin' things you don't mean, I know that you don't
When you feelin' angry, when you feel alone
I'll make you feel okay
I'll make you feel at home

Talkin' back to me and making such a fuss
Girl you're lucky I'm already so in love
We're gonna work through this
"
0hVZCUZKWsWFU6i5zlRZZr,Supalonely (Lownely),BENEE,0.696,0.33799999999999997,7.0,-8.611,1.0,0.037000000000000005,0.888,2.8499999999999998e-05,0.182,0.204,115.007,"I know I fucked up, I'm just a loser
Shouldn't be with ya, guess I'm a quitter
While you're out there drinkin', I'm just here thinkin'
'Bout where I should've been
I've been lonely

Water pouring down from the ceiling
I knew this would happen, still hard to believe it
Maybe I'm dramatic, I don't wanna seem it
I don't wanna panic

I'm a sad girl, in this big world
It's a mad world
All of my friends know what's happened, you're a bad thing

I know I fucked up, I'm just a loser
Shouldn't be with ya, guess I'm a quitter
"
4ZLzoOkj0MPWrTLvooIuaa,Get You The Moon (feat. Snøw),Kina,0.498,0.235,1.0,-16.541,0.0,0.188,0.72,0.0,0.14400000000000002,0.0895,118.917,"You gave me shoulder when I
Needed it
You showed me love when I
Wasn't feeling it
You helped me fight when I
Was giving in
And you made me laugh when I was losing it

'Cause you are, you are the reason why I'm still
Hangin' on
'Cause you are, you are the reason why my head is still
'Bove water
And if I could I'd get you the moon and
"
7EurJLsr9GPEp8Aq5LJvOK,Somewhere in Ann Arbor,Anson Seabra,0.5660000000000001,0.153,1.0,-14.133,1.0,0.0399,0.932,2.59e-06,0.0946,0.39899999999999997,90.493,"Somewhere in Ann Arbor there's a broken traffic light
Blinking softly for an audience of one
A boy who takes his comfort in the shelter of the night
And stays up until the morning just because

Somewhere in Ann Arbor there's an empty parking lot
Where he likes to go and look up at the moon
Ask himself where things went wrong and why he feels so caught
And hopes that things start changing someday soon

Oh, he's got it all
He's got the life that they all said that he would want
And oh, he's got it good
"
3bmgfeipIJSaOQRCm921Q6,Good on My Own,Jomie,0.501,0.7070000000000001,0.0,-5.331,1.0,0.414,0.588,0.0,0.327,0.499,159.755,
3aNYisjLM8Wheus3XR7RZb,Blade Of Hope,Leo Bhanji,0.618,0.535,0.0,-11.418,1.0,0.488,0.8909999999999999,0.105,0.0799,0.327,165.93200000000002,
5HkDr6w8kst095gAP09k8C,Just a Little Bit Lonely,yaeow,0.45799999999999996,0.488,2.0,-11.546,1.0,0.0554,0.9309999999999999,0.248,0.33299999999999996,0.593,93.14,"I talk about you when I'm sleepin'
When I go out, yeah I miss your friends

I hate myself for just leavin'
Yeah I miss your face

And it starts to feel a little bit lonely
Just little bit lonely yeah
Just little bit lonely yeah

And it starts to feel a little bit lonely
"
0xhMIv4WasTVRl951qRXhh,Too Much,Lokel,0.7290000000000001,0.397,1.0,-9.062999999999999,1.0,0.0401,0.18100000000000002,0.6629999999999999,0.09699999999999999,0.375,76.014,
1WBInECBaOJMhYmxWkz510,Putting a Spin on Sweater Weather,Egg,0.502,0.0631,10.0,-21.59,1.0,0.0534,0.992,0.007659999999999999,0.0973,0.13,75.6,"All I am is a man
I want the world in my hands
I hate the beach
But I stand in California with my toes in the sand
Use the sleeves of my sweater
Let's have an adventure
Head in the clouds but my gravity's centered
Touch my neck and I'll touch yours
You in those little high waisted
Shorts, oh She knows what I think about
And what I think about
One love, two mouths
One love, one house
No shirt, no blouse
Just us, you find out
Nothing that wouldn't wanna tell you about no
'Cause it's too cold whoa
For you here and now
So let me hold whoa
Both your hands in the holes of my sweater
"
3N5Ez4Xd5SIRBUh3eZ4C7s,Weep,Brandon,0.698,0.11599999999999999,2.0,-12.287,0.0,0.0365,0.894,8.540000000000002e-05,0.0998,0.254,124.1,
0MztsqxURlitrtr1Ruu0uw,Ugly,Deb Never,0.767,0.509,0.0,-7.331,1.0,0.0847,0.0872,8.79e-06,0.13,0.14300000000000002,142.942,"You don't want me, I don't want you
You don't wanna do things I want to
Why can't we separate?
Am I that desperate to feel the way that we used to?
When you don't want me but I need you

I remember when we stayed awake
The neighbors complained at four AM
I'll never forget how you make me cry just to laugh again
Like a drug addict
I can't predict how you make me feel
I don't answer my phone unless I see your name
"
0gDKiMAurqJFzRKEKUOVbE,"From Me, the Moon",Lav,0.556,0.0179,0.0,-28.603,1.0,0.0383,0.995,0.16,0.0684,0.152,99.41799999999999,"Two years and you still look the same
Wide blinking eyes look at me the same way
Do my lips take you back to June?
Do my lips make you miss me too?

Tell me if the years are all gone
Is the moon still in love with the sun?
Do you still keep counting my sins?
Will your heart ever forgive my skin?
"
5OCgxL9wr0gLTiBE6525Ma,Growing Up,Christian Alexander,0.8809999999999999,0.28,0.0,-9.29,1.0,0.15,0.515,0.00818,0.0672,0.583,72.521,"All you want is a song
All I need is a girlfriend
All you want, is a song from me
All I need is a girlfriend

Why you tryna ring my phone?
You should know that I won't pick up
Why you tryna get in touch?
Don't you know I don't give a fuck?

Growing up, I'm growing up
Life is moving on, it never stops
And one day, we're all gonna die
"
4W8sUeokQKfHt1uTXp0Jq0,Broken,Lund,0.83,0.583,0.0,-2.052,1.0,0.0412,0.0563,0.0005,0.109,0.146,134.0,"Will you end my pain?
Will you take my life?
Will you bleed me out?
Will you hang me out to dry?
Will you take my soul in the midnight rain?
While I'm falling apart
While I'm going

Will you end my pain?
Will you take my life?
Will you bleed me out?
Will you hang me out to dry?
Will you take my soul in the midnight rain?
While I'm falling apart
While I'm going (yeah) insane

Say you really want to shine in the limelight
Pick up, I'ma call when the time's right
I ain't really want to put you in the friend zone
Why you always feel alone when your friends home
Life's hard, everybody sees cloudy days
I just want a piece of mind, make me want to wait
I won't ever tell a lie see it in my face
I be thinking all the time about a better place

I be talking to the mic like it's my girl
Vibe with her get high in another world
Talk to her she listening to me closely
We winning in the game, where my trophy?
"
47EWMOElkkbMp5m9SBkx7d,IDK You Yet,Alexander 23,0.629,0.306,1.0,-11.735,1.0,0.0424,0.884,0.0776,0.124,0.191,76.994,"How can you miss someone you've never met?
'Cause I need you now but I don't know you yet
But can you find me soon because I'm in my head?
Yeah, I need you now but I don't know you yet

'Cause lately it's been hard
They're selling me for parts
And I don't wanna be modern art
But I only got half a heart
To give to you

How can you miss someone you've never seen?
"
39aTqaiVKvYoPgW828eWUQ,Those Brown Eyes,ohsobrkn,0.505,0.586,10.0,-12.012,1.0,0.769,0.667,1.0199999999999999e-05,0.11599999999999999,0.736,76.999,"Don't look at me like that with those brown eyes brown eyes
Oh you drivin' me wild
Don't look at me like that with those brown eyes brown eyes
Oh you drivin' me wild
Your eyes aren't really that brown but girl they're definitely blue
But it don't matter, any color babe I'm still loving you
Can we go ride on a date maybe chill at the zoo
I'm taking instagram pics of you with two kangaroos
And really I'm a loser when I see you I feel stupid
"
18WI5LEikfhXo606KbapYf,blue,the bootleg boy,0.7070000000000001,0.314,6.0,-14.06,0.0,0.0377,0.6459999999999999,0.0288,0.18600000000000003,0.335,114.978,"Baby bluer than the ocean
Drained out every drop of my devotion
Out west to burn in the horizon

Baby's been bluer than the ocean
Played out every song he's set in motion
All night to brighten my horizon

"
0qxcxet7ALr8LEB04dCila,regrets,TruePilot,0.465,0.392,9.0,-12.305,1.0,0.18600000000000003,0.36200000000000004,2.12e-05,0.537,0.336,77.413,"It's been so long
I've gotten numb
I just forgot
How it is to be alone
Hearts feels like stone
Getting up off my knees
Dream of what I could own
But I'm only 18

I've been thinking alone
Cause I don't know why I feel this way
My mind starts to roam
Cause I know that I'm never gonna be that way
Now it's got me reaching into the dark
Cause I don't wanna be insane anymore
And I should be ashamed
Cause I felt the same before

I know what I want
"
24iOFsulTYMdH8t5EuF9RU,Missing with Reality,Timmies,0.778,0.0694,1.0,-13.287,0.0,0.19,0.408,0.00124,0.172,0.151,69.99,
429NtPmr12aypzFH3FkN9l,Coffee,beabadoobee,0.532,0.13699999999999998,9.0,-18.208,1.0,0.0717,0.982,0.9620000000000001,0.11199999999999999,0.301,118.734,"Don't stay awake for too long
Don't go to bed
I'll make a cup of coffee for your head
I'll get you up and going out of bed
And I promise that one day I'll feel fine
And I promise that one day I'll feel alright

And I'll make a cup of coffee
With the right amount of sugar
How you like it
And I'll make a cup of coffee
"
0BIdtZ1RdHNAm1aJxbfyNk,Wavvy,Lav,0.5479999999999999,0.31,2.0,-10.03,0.0,0.0328,0.561,0.563,0.0774,0.0875,139.675,"I know you like me in the dark
But when my car is parked
Can you see me in the light?
Can you pull it from my eyes?

And if I would have waited
Would you have called me baby?
'Cause the only thing you say is
""Maybe when you're wavy""
But if I would have waited
"
1fgC2MHbJnPgvDfdTpC62c,Feel Again (Feat. Au/Ra),Kina,0.48700000000000004,0.384,5.0,-10.594000000000001,1.0,0.0587,0.24,0.0,0.124,0.22399999999999998,78.138,"We were just kids and we didn't know nothin'
It didn't make sense, but it felt like somethin'
Remember when I said that ""I love you for life""
Baby, it wasn't a lie
Right one at the wrong time
How'd we get here, never saw it comin'

You make me feel like, I can feel again (I can feel again)
You make me realize, the story didn't end (the story didn't end)
I didn't know my heart could hurt like that
"
6HeCk6yewXH7WO4D93eub9,Ruthless (Nice Guys Always Finish Last),MarMar Oso,0.7240000000000001,0.26899999999999996,5.0,-15.465,1.0,0.0456,0.38799999999999996,0.0,0.0808,0.866,86.042,"Okayy, okayy
Nice guys always finshed last should've know that
Gave you my heart and you fucked around and broke that
So sad
Pretty girls I hurt you so bad (baaaad)

Girl you played me
Did me so shady
Got me in my feelings
I can't trust lately
You so lame, took me as a game
Say guys are dogs, well all girls the same
Karma where you at? you better have my back
'Cause you know damn well I didn't deserve that
Oh I finna lose it, got me lookin' stupid
From now on ima be ruthless
(Oh oh oh)
(Oh oh oh)
(Oh oh oh) Mmm

Thought I was in love
Got me thinkin' to myself I wasn't enough
I remember late nights all alone
Waitin' by my phone just to see your name with a ringtone
But you, never called
You ain't ever cared
Told me that you love me
You were never there

What did I do to deserve this treatment
Never thought you'd be the one that I caught cheated

"
4sSu9BtWSCWRNjGD2AvqbG,Psycho!,MASN,0.868,0.365,7.0,-9.51,1.0,0.0383,0.433,0.0,0.207,0.47100000000000003,114.979,"Haha
Big fourteen, know what the fuck goin' on
I might just go psycho
Too many drunk white hoes
Yeah

I might just go psycho
Too many drunk white hoes
Said I won't but I might though
Walking on the tight rope
Do it just in spite though
Backwoods got my eyes low
I might just go psycho
Backwoods had my eyes low

I just left in the Porsche
I'm moving too fast I cannot slow it down
On my way to the morgue
I'm dying young if I don't slow it down
Too much cash in the bag
I'm burning it all, nothing can stop me now
Gave you one more chance
You lost that shit and you just lost a crown
"
0jltLZz2X5uuBNY4ujWafX,Quarantined from My Love,ohsobrkn,0.879,0.51,6.0,-9.001,1.0,0.34600000000000003,0.19399999999999998,0.0,0.605,0.557,139.95600000000002,
4P1L6AniTDJzANaubzWGYs,I'm Not Enough and I'm Sorry,Teqkoi,0.698,0.183,8.0,-20.188,1.0,0.299,0.462,0.000424,0.335,0.244,143.96,"I'm done feeling worthless
Imperfect
You hit me where it hurts
You put the blade right on my wrist
And slit until it spurts
Out blood Red
Dead

That's just how I'm feeling
You tell me that you love me
But there you go leaving
Why you so suprised?
You're a demon in disguise
These past two weeks all I've been doing is
Crying

Tired of putting all my effort
But never recieving
"
65gamarWLet1XzenwaeMVt,Euphoria.,James Curry,0.6970000000000001,0.51,11.0,-10.46,0.0,0.091,0.48100000000000004,0.0028,0.134,0.161,80.042,"You're saying that you want me you don't really understand
Thought that we were friends now you're tryna' hold my hand
Told her I don't want no money, I don't want no fucking fans
Got the the type of friends that'll fly out to Japan
I ain't got no other plan though
I ain't got no other plan though
I'd rather hide then go make a couple bands though

Look they made a song, now they say their life's a movie
That shit be Ironic cause they sitting and they bruising
They got money and they wanna spend it like they're cruising
Yeah yeah now they pull up, now they losing

You make tracks to make stacks
"
3l3lUyNu5zh6H6uByc5Xnr,If I Really Love You,Lexi Jayde,0.498,0.24100000000000002,0.0,-14.095999999999998,1.0,0.0324,0.7759999999999999,2.51e-05,0.113,0.131,121.848,"Yesterday you told me that you wanna be alone
I could hear the distance in your voice over the phone
You don't say ""I love you"" back
Or let your feelings show
You used to be so good at that
But now I never know

I wish you would hold me
I wish you would tell me how you feel
Want you to show me

If anything left in this is real

'Cause, maybe, I'm afraid to
See you dancing on your own

If I really love you
"
6mYnhUDS5mJ00d4vCcXaXa,I think I love u,Lemonah,0.845,0.125,5.0,-14.870999999999999,0.0,0.0894,0.9570000000000001,0.745,0.0609,0.787,89.971,
7eJMfftS33KTjuF7lTsMCx,death bed (coffee for your head),Powfu,0.726,0.431,8.0,-8.765,0.0,0.135,0.731,0.0,0.696,0.348,144.026,"Don't stay awake for too long
Don't go to bed
I'll make a cup of coffee for your head
I'll get you up and going out of bed, and I

Yeah
I don't wanna fall asleep, I don't wanna pass away
I've been thinking of our future 'cause I'll never see those days
I don't know why this has happened, but I probably deserve it
I tried to do my best, but you know that I'm not perfect

I've been praying for forgiveness, you've been praying for my health
When I leave this earth, hopin' you'll find someone else
'Cause, yeah we still young, there's so much we haven't done
Getting married, start a family, watch your husband with his son

I wish it could be me, but I won't make it off this bed
I hope I go to heaven so I see you once again
My life was kinda short, but I got so many blessings
Happy you were mine, it sucks that it's all ending

Don't stay awake for too long
"
6BI0Na9AtisZ3PpkPqEeXk,dropout,brakence,0.752,0.273,1.0,-11.269,1.0,0.138,0.445,0.0,0.155,0.629,141.039,"I can't wait no longer
Would you say something?
I can't wait no longer

Dropped out, I was 17
Wasting all my money mixing dope and LSD
Man, mama said don't get ahead of me
But I don't wanna finish college, I got hella dreams
Well, I don't know what's gotten into me
Ever since I stopped pretending, it was history
Dropped out, I was 17
Now I've got more freedom than I've ever seen

Life don't have directions
And I been trying to quarantine
The thought of heaven in the meantime
I've realized I've been there before
All the doors are closed
Wanted so much more
Now its nice to know
There's no inner me
Or a victory
Its all costumes, funny dances to-
I can do anything
"
1eVNC3w8fJQYRm8T6anCEd,At Night I Miss You the Most,Jordy Chandra,0.445,0.151,0.0,-19.349,1.0,0.0327,0.963,0.195,0.0876,0.187,143.765,"Do you ever think about me the night i miss you
The night i wish you were here
If i could turn back time when we're still
Together and we, will talk until we sleep

I need you
I want you
Wanna ditch the past but then i cannot lie that i
I miss you
"
1kAkUHFb7ryeVkVSRD6Nkj,Wish I Was Better,Kina,0.732,0.304,0.0,-13.085999999999999,0.0,0.111,0.747,6.13e-05,0.14300000000000002,0.185,139.965,"I been calling you up 'cause I'm missing you
I don't even know what I'm gonna do
I say I don't care, that's not the truth
Yeah, I'm still in love with you
And I know all your friends, they hate me too
I wish that I was better at the things I do
I say I don't care, that's not the truth
Yeah, I'm still not over you

I been calling you up 'cause I'm missing you
I don't even know what I'm gonna do
I say I don't care, that's not the truth
Yeah, I'm still in love with you
"
57Cb3vwdsyb3w8LsYcQXSj,You Know That I Don't Play,Shiloh Dynasty,0.565,0.54,7.0,-13.989,1.0,0.442,0.953,0.0184,0.12,0.42100000000000004,78.38,"Grips on your waist
Front way, back way
You know that I don't play

Street not safe
But I never run away
Even when i'm away
Grips on your waist
Front way, back way
You know that I don't play
Streets not safe
But I never run away
Even when I'm away
"
1oNMceptUaTWuOmJl1UCqH,like crazy,Aidan,0.581,0.298,10.0,-13.46,0.0,0.0485,0.86,3.84e-06,0.111,0.0895,64.9,"Yeah I can feel your heartbeat, baby
Can't stop getting wasted lately
I think it's 'cause I miss you crazy
Like crazy
Like crazy
Oh, I can feel your heartbeat baby
Your fingers on my chest keep tracing
The lines where I miss you daily
Like crazy
Like crazy
Ohoh

I wish that I could be there in the morning
Hiding under sheets while the rain keeps pouring
Pouring on our window
Pouring on our window
I wish that I fly home in the morning
'Cause I don't feel at home here I think you stole it
I think you brought it with you
"
45bE4HXI0AwGZXfZtMp8JR,you broke me first,Tate McRae,0.642,0.374,4.0,-9.386000000000001,1.0,0.0545,0.7859999999999999,0.0,0.0906,0.0799,124.09899999999999,"You broke me first

Maybe you don't like talkin' too much about yourself
But you should've told me
That you were thinking 'bout someone else
You're drunk at a party
Or maybe it's just that your car broke down
Your phone's been off for a couple of months
So you're callin' me now

I know you, you're like this
When shit don't go your way
You needed me to fix it
And like me, I did
But I ran out of every reason

Now suddenly, you're askin' for it back
Could you tell me, where'd you get the nerve?
Yeah, you could say you miss all that we had
"
1vMG36UC8imqUWv20ycx54,Angel,vict molina,0.546,0.0327,10.0,-31.214000000000002,1.0,0.0311,0.87,0.0116,0.0861,0.46799999999999997,160.245,"California
On a sunday morning
We got up
And made some coffee
"
7BrbGr8S8rjrnlGLqtfFwA,i still think of you,the bootleg boy,0.575,0.193,2.0,-15.494000000000002,1.0,0.179,0.951,0.0443,0.156,0.308,118.589,"If you go to bed, then when will I see you?
If I'm not enough then how can I be with you, anymore?

'Cause I'm not your savior
I'm just a man with a thousand endings
No, just a boy
Whose favor
Lacks the heart to last
I'm just a boy, a boy with a thousand endings
"
5PqreNOgHtz0JusSoeitaF,im used to it,Powfu,0.647,0.341,0.0,-8.51,1.0,0.0382,0.752,0.0,0.102,0.337,79.072,"Yeah, yeah, ayy

I've been chasin' dreams
Hope it works out
Shootin' for the stars
Got me burnt out
I got nothin' else in store
This is all I'm askin' for, ayy

Stay inside my room
High school doesn't miss me
Didn't go to prom
Had no one to go with me
I didn't want to ask you out
'Cause I'm not who you talk about

Yeah, I'm used to this
To say more shit (Say more shit)
Left alone wherever I say (Wherever I say)
Why's this place so dry?
No love to find (So dry)
"
2JFIniB5VkK453yM5KkDLX,Darya,Sk8dumpling,0.74,0.228,4.0,-16.764,0.0,0.0387,0.899,0.225,0.11599999999999999,0.243,99.93799999999999,
2hkrK4tbCWGhUlF0rtQzBs,i don't wanna fall in love,XINCLAIR,0.636,0.469,2.0,-10.334000000000001,1.0,0.385,0.747,0.0,0.05,0.603,160.071,
