track id,track name,artist,danceability,energy,key,loudness,mode,speechiness,acousticness,instrumentalness,liveness,valence,tempo,lyrics
7piFoJog4nNUCfnpOzFzSO,Little Bit Of Love - Indian Summer Remix,JP Cooper,0.708,0.758,7.0,-4.453,1.0,0.0367,0.0133,1.04e-05,0.418,0.272,101.01700000000001,"When you try to find the words but they ain't flowin'
When you're sittin' by the phone but no one's callin'
Call me up and I'll be on my way

When you're acting like you're fine but you ain't copin'
And you're listenin' to too much Leonard Cohen
Hallelujah's just a prayer away

If you're lost and alone in the dark and you're all cried out
If you're bruised and you're broken, I'm hoping you'll hear me out
Sometimes everybody needs a

Little bit of love
When you're down and out, your heart is breaking
Little bit of love
And with every single smile you're faking it
Little bit of love
I've got a
Little bit of love
I've got a
Little bit of love

Little bit of love
Little bit of love
"
6wXgnhpmOPEJ7cUweSyy2B,Dance with Me (feat. Thomas Rhett & Young Thug),Diplo,0.73,0.792,6.0,-5.33,0.0,0.13,0.0264,0.0,0.10099999999999999,0.745,99.039,"Had another dream, about you
These days, only thing I do
We've been standing in, the same room
People talking, but I don't want to

It's in one ear, and out the other
I see you lookin' at me, but you with another
Goes in one ear, and out the other
Both eyes open, and I can hear em' sayin'

Dance with me, dance with me
Play that song, like baby, one, two, three
Come in close, and give me your body
Let's take it so far, so far, there's nowhere left to go

Dance with me, dance with me
Play that song like baby, one, two, three
Come in close, and give me your body
Let's take it so far, so far, there's nowhere left to go

Na-na-na-na, na-na-na-na
Na-na-na-na, nowhere left to go
Na-na-na-na, na-na-na-na
Na-na-na-na

"
1b3nlcP6hogIzYRVK2Ui7K,Wherever You Are,Kodaline,0.514,0.612,4.0,-5.981,1.0,0.0298,0.142,0.0,0.0868,0.342,125.99,"You say you love me
You say you care
And when you're with me
My future's there

We get carried away in emotion
We get lost in each other's eyes
And we forget what we regret
As we cast our fears aside

When the world's getting hard
I will go to wherever you are
Running blind in the dark
I will go to wherever you are

Wherever you are
That's where I'll be
"
24ySl2hOPGCDcxBxFIqWBu,Rain On Me (with Ariana Grande),Lady Gaga,0.672,0.855,9.0,-3.764,1.0,0.0397,0.021,0.0,0.32299999999999995,0.6459999999999999,123.056,"I didn't ask for a free ride
I only asked you to show me a real good time
I never asked for the rainfall
At least I showed up, you showed me nothing at all

It's coming down on me
Water like misery
It's coming down on me
I'm ready, rain on me

I'd rather be dry, but at least I'm alive
Rain on me, rain, rain
Rain on me, rain, rain
I'd rather be dry, but at least I'm alive
Rain on me, rain, rain
Rain on me

Rain on me
Mmh, oh yeah, baby
Rain on me

Livin' in a world where no one's innocent
Oh, but at least we try, mmh
"
5id3Rqn7SPj1LX4FfY4nGz,Together,Sia,0.521,0.877,7.0,-5.444,1.0,0.0683,0.0132,0.0806,0.0929,0.19899999999999998,180.007,"Ooh, together
We can take it higher

I can hear the thunder
Coming from your mouth
And I know my number's up
Give me some Stevie Wonder
Quick, put it on before we go under

I can see the lightning
Coming from your ears
Yeah, I see you're frightened
I can see the lion
Sleeps tonight in the tears you're crying

Ooh
Can't love me unless you love you too
Treat yourself like nothing but a fool
Can't love me unless you love you too
Love you too

Come now, set the past on fire
Stand up, raise your face to the sky, my love
Together, we can take it higher
(Ooh, together)
We can take it higher

Come now, set the past on fire
Stand up, raise your face to the sky, my love
"
4uqh9bualXNHXXwO2wPorc,Daisies,Katy Perry,0.639,0.546,1.0,-5.382000000000001,1.0,0.0407,0.0837,0.0,0.122,0.149,122.179,"Told them your dreams and they all started laughin'
I guess you're out of your mind 'til it actually happens

I'm the small town
One in seven billion
Why can't it be me?

They told me I was out there
Tried to knock me down
Took those sticks and stones
Showed 'em I could build a house
They tell me that I'm crazy
But I'll never let 'em change me
'Til they cover me in daisies, daisies, daisies

They said I'm goin' nowhere
Tried to count me out
Took those sticks and stones
Showed 'em I could build a house
They tell me that I'm crazy
But I'll never let 'em change me
'Til they cover me in daisies, daisies, daisies

"
7xbWAw3LMgRMn4omR5yVn3,Lose Somebody,Kygo,0.58,0.586,1.0,-6.882999999999999,1.0,0.0357,0.344,0.0,0.0755,0.507,147.988,"It's a classic me mistake
Someone gives me love and I throw it all away
Tell me have I gone insane?
Talkin' to myself but I don't know what to say

'Cause you let go
And now I'm holdin' on
I guess you don't know what you got
Until it's gone

Sometimes you gotta lose somebody
Just to find out you really love someone
Oh-oh-oh, and I do, and I do, and I do, yeah
Sometimes you gotta lose somebody
Just to find out you really love someone
Oh-oh-oh, yeah
Sometimes you gotta lose somebody

"
49dFIRQCQxPWgoH0m38XQ5,Summer Feelings (feat. Charlie Puth) - From 'SCOOB!' The Album,Lennon Stella,0.696,0.6859999999999999,5.0,-6.1129999999999995,0.0,0.0309,0.262,0.0,0.174,0.7,115.98200000000001,"I hear the rhythm of waves hittin' on the shore
And I can swear they're speakin', speakin', speakin'
They're tellin' me to relax, I'm not good at that
But now, I know I need it, need it, need it (I slide)

Ooh, now what you do? My tan lines tell the truth (I slide)
Yeah, on Venice beach, got sand all in my shoes (Tonight)
Ooh, unlock me loose, see the sunset from the roof (That's right)
Yeah, that crystal blue, and I came out someone new

Hey, gettin' in my summer feelings
And I'm trying to keep it cool
Way up here in my summer feelings
And I found a piece of me that I never knew
"
0VjIjW4GlUZAMYd2vXMi3b,Blinding Lights,The Weeknd,0.514,0.73,1.0,-5.934,1.0,0.0598,0.00146,9.54e-05,0.0897,0.33399999999999996,171.005,"Yeah

I've been tryna call
I've been on my own for long enough
Maybe you can show me how to love, maybe

I'm going through withdrawals
You don't even have to do too much
You can turn me on with just a touch, baby

I look around and
Sin City's cold and empty (Oh)
No one's around to judge me (Oh)
I can't see clearly when you're gone

"
2Yer0p7uB2lVBUAtANuuQp,Magic In The Hamptons (feat. Lil Yachty),Social House,0.769,0.479,1.0,-5.3389999999999995,1.0,0.0385,0.66,0.0,0.0914,0.8029999999999999,96.051,"Spot a little hottie when I flipped out the shades
Lookin' like a red 'Rari sittin' in a driveway
Bottle of Cîroc with a hint of Kool-Aid
She done pulled up like I'm getting rid of weeds
Are you tired from running through my mind?
Take a break and we can have a good time
Show you moves like I'm the new James Brown
Me and you should get a room right now

'Cause if it's gold, I'll throw it away
You're worth more than every single chain
It ain't gon' work if you don't want it to
Best drink I take is when I'm sippin' you

You know where I go when we're dancing
Handshakes in The Hamptons
And gettin' drunk in the mansions with you
And you look so classy
Come through with that magic
You know that I'm 'bout to smash it, it's true

"
7k6tAZp4m93oswrPqSfBbc,On Me (feat. Ava Max),Thomas Rhett,0.5479999999999999,0.721,8.0,-4.466,1.0,0.0472,0.0119,0.0,0.21600000000000003,0.594,177.918,"You could call, you could call on me
You could fall, you could fall on me
And if you want to, tell me what you gon' do
You could put it all, put it all on me

Speedin'
90 in a 65
Grabbed the keys and didn't tell 'em why
Just hit the road
When you need me
Relaxin', gettin' in my way
I'm flyin' down the interstate
Just know, just know

When you can't pull through
When life's hard on you
Know it ain't no thing
Know it ain't no thing
You know what to do

You could call, you could call on me (on me)
You could fall, you could fall on me (on me)
And if you want to, tell me what you gon' do
You could put it all, put it all on me
"
3Z8FwOEN59mRMxDCtb8N0A,Be Kind (with Halsey),Marshmello,0.63,0.633,4.0,-7.087999999999999,1.0,0.0457,0.0077599999999999995,0.0,0.0541,0.452,93.995,"Wanna believe, wanna believe
That you don't have a bad bone in your body
But the bruises on your ego make you go wild, wild, wild, yeah
Wanna believe, wanna believe
That even when you're stone-cold, you're sorry
Tell me why you gotta be so outta your mind, yeah

I know you're chokin' on your fears
Already told you I'm right here
I will stay by your side every night

I don't know why you hide from the one
And close your eyes to the one
Mess up and lie to the one that you love
When you know you can cry to the one
Always confide in the one
You can be kind to the one that you love
"
3KkXRkHbMCARz0aVfEt68P,Sunflower - Spider-Man: Into the Spider-Verse,Post Malone,0.76,0.479,2.0,-5.574,1.0,0.0466,0.556,0.0,0.0703,0.9129999999999999,89.911,"Ayy, ayy, ayy, ayy (Ooh)
Ooh, ooh, ooh, ooh (Ooh)
Ayy, ayy
Ooh, ooh, ooh, ooh

Needless to say, I keep her in check
She was a bad-bad, nevertheless (Yeah)
Callin' it quits now, baby, I'm a wreck (Wreck)
Crash at my place, baby, you're a wreck (Wreck)

Needless to say, I'm keeping her in check
She was all bad-bad, nevertheless
Callin' it quits now, baby, I'm a wreck
Crash at my place, baby, you're a wreck

Thinkin' in a bad way, losin' your grip
Screamin' at my face, baby don't trip
Someone took a big L, don't know how that felt
Lookin' at you sideways, party on tilt
"
5iFwAOB2TFkPJk8sMlxP8g,Make You Mine,PUBLIC,0.606,0.799,9.0,-4.452,1.0,0.0261,0.0128,0.0,0.15,0.638,103.014,"Well, I will call you darlin'
And everything will be okay
'Cause I know that I am yours
And you are mine
Doesn't matter anyway

In the night, we'll take a walk
It's nothing funny, just to talk

Put your hand in mine
You know that I want to be with you all the time
You know that I won't stop, until I make you mine
You know that I won't stop, until I make you mine
Until I make you mine

Well, I have called you darlin'
"
4ZTTUAjJCd4NMZmIU7RB4c,Midnight (feat. Liam Payne),Alesso,0.5870000000000001,0.648,11.0,-6.9270000000000005,0.0,0.0439,0.0561,0.0,0.115,0.281,144.028,"Always thought I was losin' the race
Lookin' for love in all the wrong places
Really don't know how we made it here
Never thought I was worth what you give
Never felt quite alive, now I'm livin'
Yeah, you kill my doubts, they disappeared

When I feel like nothing's gonna hold me down
Hold me down, you do
Used to be scared of fallin'
'Til you came around, came around

Now I just wanna stay here, fall into midnight
Want nobody else now, only you, feel right
Time enjoyed wasted's not wasted time
So stay 'til the morning, stay for a while
I just wanna lay here and fall into midnight
And fall right into you
"
5Gj1wG8b12VQdEd3hUuSwo,Freedom,Kygo,0.715,0.635,7.0,-6.591,1.0,0.0791,0.127,0.0,0.0862,0.39,112.887,"Freedom-dom, freedom-dom, freedom
Freedom-dom
I've been looking for
Freedom-dom, freedom-dom, freedom
Freedom-dom
I've been looking for

I was living a lie, living a lie
This is my confession
I was living a lie before we met
There were so many nights, so many nights
Full of dark temptation
There was so many nights, that I regret

You give me something that I can hold on to
A little light when I'm down on my knees
I was so lost in myself when I found you
But in that moment you made me believe

You give me, freedom, freedom
Freedom I've been looking for
Freedom, freedom is you
You give me, freedom, freedom
"
62aP9fBQKYKxi7PDXwcUAS,ily (i love you baby) (feat. Emilee),Surf Mesa,0.674,0.774,11.0,-7.567,0.0,0.0892,0.0686,0.0018800000000000002,0.39299999999999996,0.33,112.05,"I love you, baby, and if it's quite all right
I need you, baby, to warm these lonely nights
I love you, baby
Trust in me when I say

I love you, baby, and if it's quite all right
I need you, baby, to warm these lonely nights
I love you, baby
Trust in me when I say

I love you, baby

I love you, baby

I love you, baby, and if it's quite all right
"
3H7ihDc1dqLriiWXwsc2po,Breaking Me,Topic,0.789,0.72,8.0,-5.652,0.0,0.218,0.223,0.0,0.129,0.664,122.031,"La-la-la-la, la-la-la-la

Call me what you wanna, I'll be what you wanna
I've been here a thousand times, eh-eh
Fallin' for another, I don't even bother
I could do it all my life

So tell me if you wanna 'cause I got this feeling
I wanna hear you say it 'cause I can't believe it
With every touch of you, it's like I've started dreaming
Guess Heaven's not that far away

And I'll be singing, la-la-la-la, la-la-la-la
You're breaking me, la-la-la-la, la-la-la-la
You're breaking me, la-la-la-la, la-la-la-la
You're breaking me, la-la-la-la, la-la-la-la

I'm just right here dancing around to the rhythm
"
7kQkmyoHCEqwe7QwDbkSXM,Let's Fall in Love for the Night,FINNEAS,0.737,0.408,5.0,-7.941,1.0,0.10400000000000001,0.802,0.0,0.171,0.374,127.921,"Let's fall in love for the night
And forget in the mornin'
Play me a song that you like
You can bet I'll know every line
I'm the boy that your boy hoped that you would avoid
Don't waste your eyes on jealous guys, fuck that noise
I know better than to call you mine

You need a pick me up?
I'll be there in twenty five
I like to push my luck
So take my hand, let's take a drive
I've been livin' in the future
Hopin' I might see you sooner
I want you, riding shotgun
"
3QpkbrYXtlU3LRJu3sTK6V,Joy,Bastille,0.5589999999999999,0.915,9.0,-4.811,1.0,0.132,0.222,0.0,0.113,0.361,117.914,"Thought I'd never be waking on the kitchen floor
But here I lie, not the first time
Now my morning has broken, and it brings the fear
My mind's falling, falling

Then I feel my pulse quickening
But regrets can't change anything
Yeah, I feel my pulse quickening
When your name lights up the screen

Oh Joy, when you call me
I was giving up, oh, I was giving in
Joy, set my mind free
I was giving up, oh, I was giving in

How'd you always know when I'm down?
How'd you always know when I'm down?

"
2K0r5GD5zYlEMx2M7ZMcqG,Better Days,OneRepublic,0.626,0.726,5.0,-5.015,1.0,0.0376,0.235,0.0,0.304,0.257,89.132,"Oh, I know that there'll be better days
Oh, that sunshine 'bout to come my way
May we never ever shed another tear for today
'Cause, oh, I know that there'll be better days

Wakin' up in California
But these clouds, they won't go away
Every day is like another storm, yeah
I'm just tryin' not to go insane
Yeah, in the city's shinin' so bright
So many dark nights, so many dark days
But every time I feel the paranoia
I close my eyes and I pray
"
28Tv8zltFDr5wBCG3Pfky4,I Love You's,Hailee Steinfeld,0.682,0.7829999999999999,8.0,-4.997,1.0,0.18,0.0262,0.0,0.20600000000000002,0.32299999999999995,106.899,"Doo bee doo bee doo doo doo, ah
Doo bee doo bee doo doo doo, ah
Doo bee doo bee

Where do I begin?
I'm seating here jaded
Yeah, I fell asleep with the make-up still all on my skin
Wide wake again
I'm praying I make it
I'm steppin' the 12 but it's somewhere I've already been

Diamonds won't fool me 'cause I'm too far gone
Wish I could get back the air in my lungs
I've been so fucked up it's bad for my heart
My heart

So, no more I love you's
It's too easy to say, yeah
No more I love you's
Until I'm OK
I blamed it on the time zones
I blamed it on my eyes closed
"
5SspaMrPfWyRCS0GpjIxa6,Good Example (with Andy Grammer),R3HAB,0.456,0.496,1.0,-6.986000000000001,1.0,0.0743,0.42700000000000005,0.0,0.134,0.45,90.552,"When I'm away
When I can't stay
You know my heart breaks every night that I'm without you
Oh, my dear
I need you to hear
There's a reason for the miles that surround us

One day, I'ma look in your eyes
Tell you you were made to shine
Tell you to go out and find, out and find
What makes you come alive
One day, I'ma point to the sky
Tell you you were made to fly
When I'm gone, for too long, it's hard to handle
You know I'm trying to be a good example

"
7rpNuuoMbid56XkDsx2FjE,Black And White,Niall Horan,0.44299999999999995,0.5820000000000001,2.0,-6.02,1.0,0.0482,0.0301,0.0,0.127,0.239,147.589,"That first night we were standing at your door
Fumbling for your keys, then I kissed you
Ask me if I want to come inside
'Cause we didn't wanna end the night
Then you took my hand, and I followed you

Yeah, I see us in black and white
Crystal clear on a star lit night
In all your gorgeous colors
I promise that I'll love you for the rest of my life
See you standing in your dress
Swear in front of all our friends
There'll never be another
I promise that I'll love you for the rest of my life

Now, we're sitting here in your living room
Telling stories while we share a drink or two
And there's a vision I've been holding in my mind
"
76nqCfJOcFFWBJN32PAksn,Kings & Queens,Ava Max,0.638,0.688,1.0,-4.056,0.0,0.0407,0.00775,0.0,0.126,0.434,129.856,"If all of the kings had their queens on the throne
We would pop champagne and raise a toast
To all of the queens who are fighting alone
Baby, you're not dancing on your own

Can't live without me, you wanna, but you can't, nah-nah-nah
Think it's funny, but honey, can't run this show on your own
I can feel my body shake, there's only so much I can take
I'll show you how a real queen behaves

Oh-oh, no damsel in distress, don't need to save me
Once I start breathing fire, you can't tame me
And you might think I'm weak without a sword
But if I had one, it'd be bigger than yours

"
20d27F17AZOxTJOEHAVK2Y,Conversations in the Dark - John Legend vs. David Guetta,John Legend,0.5720000000000001,0.742,8.0,-4.5889999999999995,0.0,0.0347,0.245,0.0,0.10800000000000001,0.376,127.19,"Talk
Let's have conversations in the dark
World is sleep and I'm awake with you
With you

Watch
Movies that we both already seen
I ain't even looking at the screen, it's true
I've got my eyes on you

And you say that you're not worthy
You get hung up on your flaws
But in my eyes, you are perfect as you are

I won't ever try to change you, change you
I will always want the same you, same you
Swear on everything I pray to

That I won't break your heart
I'll be there when you get lonely, lonely
Keep the secrets that you told me, told me
And your love is all you owe me
"
5Pgq1Gfeth2CuUhyCXwlfC,Take It Easy,Surfaces,0.765,0.6890000000000001,6.0,-5.6160000000000005,1.0,0.0456,0.23600000000000002,7.39e-06,0.114,0.49700000000000005,144.958,"Oh, when you need a hand
I will be your friend
Oh, when you need a hand
Oh, I will be your friend

Take it easy, yeah
Make yourself feel right at home
Never leave me, yeah
You don't have to feel alone, yeah oh-oh

I will slip off your shoes and find your feet
Let everything come naturally
Oh, loosen the grip of what you need
Home is a state of mind, you'll see
"
4umIPjkehX1r7uhmGvXiSV,Intentions (feat. Quavo),Justin Bieber,0.8059999999999999,0.546,9.0,-6.6370000000000005,1.0,0.0575,0.3,0.0,0.102,0.8740000000000001,147.986,"Picture perfect, you don't need no filter
Gorgeous, make 'em drop dead, you're a killer
Shower you with all my attention
Yeah, these are my only intentions
Stay in the kitchen cookin' up, got your own bread
Heart full of equity or an asset
Make sure that you don't need no mentions
Yeah, these are my only intentions

Shout out to your mom and dad for makin' you
Standin' ovation, they did a great job raisin' you
When I create you're my muse
That kind of smile that makes the news

Can't nobody throw shade on your name in these streets
Triple threat, you're a boss, you a bae, you a beast
You make it easy to choose
You got a mean touch, I can't refuse (No, I can't refuse it)

Picture perfect, you don't need no filter
Gorgeous, make 'em drop dead, you're a killer
Shower you with all my attention
Yeah, these are my only intentions
Stay in the kitchen cookin' up, got your own bread
"
0TrPqhAMoaKUFLR7iYDokf,Know Your Worth,Khalid,0.79,0.6940000000000001,9.0,-7.726,0.0,0.0708,0.145,0.00252,0.281,0.508,103.007,"He keeps leaving you for dead
I don't know what you been waiting for
So you've got your love locked up instead
But somethin' better's waitin' at your door

You don't know your worth
All the things I know that you deserve
Say it's not real if it doesn't hurt
Find someone you know will put you first
Find someone who loves you at your worst

Gotta keep, gotta keep, gotta keep your head up
Gotta keep, gotta keep, gotta keep your head up
Gotta keep, gotta keep, gotta keep your head up
Who puts you first?
Find someone who loves you at your worst
"
0ycFQvBTfuo1LCdG0HhszL,Tattoos Together,Lauv,0.862,0.4,4.0,-7.486000000000001,1.0,0.0736,0.00575,7.49e-06,0.12300000000000001,0.596,122.963,"Said I'd never fall, I'd never fall
I'd never fall but then I fell for you, mm
Back against the wall, against the wall
Against the wall, that's how it felt with you, mhm, mm
One weekend in Portland
You weren't even my girlfriend
We were walkin' and talkin'
Then somebody said, ""Let's get""

Tattoos together, something to remember
If it's way too soon, fuck it, whatever
Give me shapes and letters
If it's not forever, then at least we'll have tattoos together

Mhm, 'cause I love you
Mhm, 'cause I love you
Mhm, 'cause I love you
Mhm

"
4wNIkl5XGiAACjFBlDWuSd,What A Man Gotta Do,Jonas Brothers,0.852,0.698,9.0,-7.206,1.0,0.0629,0.00839,1.03e-06,0.0773,0.324,113.039,"Cut my heart about one, two times
Don't need to question the reason, I'm yours
I'm yours
I'd move the Earth or lose a fight just to see you smile
'Cause you got no flaws, no flaws

I'm not tryin' to be your part-time lover
Sign me up for that full-time, I'm yours
All yours

So, what a man gotta do?
What a man gotta do?
To be totally locked up by you
What a man gotta say?
What a man gotta pray?
To be your last ""Good night"" and your first ""Good day""

So, what a man gotta do?
What a man gotta do?
To be totally locked up by you
What a man gotta do?
What a man gotta prove?
"
58fGC7ZRlPhW1J7kLx1goK,Keep It Simple (feat. Wilder Woods),Matoma,0.629,0.82,1.0,-5.651,1.0,0.0543,0.0142,4.34e-05,0.039,0.32899999999999996,113.95,"We lost our love
Somewhere in the darkness over yonder
Somewhere in the tall grass under cover
But I don't wanna feel that way again
I wanna go
Back to all those nights when we were driving home
No reason in the world that we can't take it slow
Oh, I just wanna feel that way again
We're growing up fast
Oh, we're growing up fast
We're growing up too fast
Wanna keep it simple
Wanna keep it simple
"
1e9oZCCiX42nJl0AcqriVo,Watermelon Sugar,Harry Styles,0.5479999999999999,0.816,0.0,-4.209,1.0,0.0465,0.122,0.0,0.335,0.557,95.39,"Tastes like strawberries
On a summer evenin'
And it sounds just like a song
I want more berries
And that summer feelin'
It's so wonderful and warm

Breathe me in, breathe me out
I don't know if I could ever go without
I'm just thinking out loud
I don't know if I could ever go without

Watermelon sugar high
Watermelon sugar high
Watermelon sugar high
Watermelon sugar high
Watermelon sugar

Strawberries on a summer evenin'
Baby, you're the end of June
"
35MKhw2YBKApmD7fAnPERC,Faith (with Dolly Parton) [feat. Mr. Probz],Galantis,0.547,0.795,8.0,-3.721,1.0,0.0489,0.145,0.0,0.11,0.723,118.118,"Know the road gets hard
And you just wanna leave
I ain't ever too far
Just have a little faith in me

When all the fears you hide
Are all you can believe
Oh, I'll be standing by your side
Just have little faith in me

Have a little faith in me
Just have a little faith in me
Have a little faith in me
Just have a little faith in me

Have a little faith in, in, in me, me
Have a little faith in, in, in me, in me
Have a little faith in, in, in me, me
"
1z1XegUChLLQfcbtIK8ABn,Body Back (feat. Maia Wright),Gryffin,0.6859999999999999,0.83,8.0,-4.437,1.0,0.0369,0.0948,1.33e-06,0.182,0.486,123.03200000000001,"Who cares what the world's gonna say?
'Cause you know they're gonna say it anyway
(And I know and I know that)
Who cares if they laugh at what we do?
'Cause it's only me and you that know the truth
(And I know and I know that)

Middle finger to the sky
They don't know 'bout you and I
We've been rollin' deeper than they'll ever know
Even though I broke your heart
No, that won't keep us apart, baby
I know, I know, I'm not giving you up

If you want my lovin', you got it
Anytime you want it
Baby, bring your body back to me
They can call me foolish and stupid
Don't know why I do this
But baby, bring your body back to me

I know, I know, I'm not giving you up
(And I know and I know that)
I know, I know, I'm not giving you up
If you want my lovin', you got it
Anytime you want it
Baby, bring your body back to me

I know, I know, I'm not giving you up, giving you up
"
1yTTMcUhL7rtz08Dsgb7Qb,The Bones - with Hozier,Maren Morris,0.561,0.597,11.0,-6.0,0.0,0.0405,0.28600000000000003,0.0,0.0979,0.355,76.82600000000001,"We're in the homestretch of the high times
We took a hard left
But we're alright
Yeah, life sure can try to put love through it, but
We built this right, so nothing's ever gonna move it

When the bones are good, the rest don't matter
Yeah, the paint could peel, the glass could shatter
Let it break 'cause you and I remain the same
When there ain't a crack in the foundation
Baby, I know any storm we're facing
Will blow right over while we stay put
The house don't fall when the bones are good

Call it dumb luck, but baby, you and I
"
3cphb8kdsjElYR7r5icK3H,Nice To Meet Ya,Niall Horan,0.591,0.841,4.0,-4.351,0.0,0.0304,0.0119,0.0,0.395,0.392,109.03399999999999,"I like the way you talk, I like the things you wear
I want your number tattooed on my arm in ink, I swear
'Cause when the morning comes, I know you won't be there
Every time I turn around, you disappear

I wanna blow your mind, just come with me, I swear
I'm gonna take you somewhere warm, you know j'adore la mer
'Cause when the morning comes, I know you won't be there
Every time I turn around, you disappear

(I got love for you)
(I got love for you)
Nice to meet ya
(I got love for you)
(I got love for you)

"
